cutlass_gemm_mainloop/results.csv
M,N,K,TILE_M,TILE_N,TILE_K,STAGES,dtype,time_ms,TFLOPS
64,16,131072,64,16,16,0,BF16,0.728806,0.368322
64,16,131072,64,16,16,2,BF16,1.93669,0.138606
64,16,131072,64,16,16,3,BF16,1.29578,0.207161
64,16,131072,64,16,16,4,BF16,0.974021,0.275595
64,16,131072,64,16,16,5,BF16,0.786021,0.341512
64,16,131072,64,16,16,6,BF16,0.717397,0.37418
64,16,131072,64,16,16,7,BF16,0.723355,0.371098
64,16,131072,64,16,16,8,BF16,0.729565,0.367939
64,16,131072,64,16,32,0,BF16,0.363544,0.738385
64,16,131072,64,16,32,2,BF16,1.01682,0.263995
64,16,131072,64,16,32,3,BF16,0.681781,0.393727
64,16,131072,64,16,32,4,BF16,0.51333,0.52293
64,16,131072,64,16,32,5,BF16,0.414211,0.648064
64,16,131072,64,16,32,6,BF16,0.36205,0.741433
64,16,131072,64,16,32,7,BF16,0.365006,0.735427
64,16,131072,64,16,32,8,BF16,0.368147,0.729153
64,16,131072,64,16,64,0,BF16,0.197181,1.36137
64,16,131072,64,16,64,2,BF16,0.55861,0.480542
64,16,131072,64,16,64,3,BF16,0.376448,0.713074
64,16,131072,64,16,64,4,BF16,0.284746,0.94272
64,16,131072,64,16,64,5,BF16,0.230712,1.16351
64,16,131072,64,16,64,6,BF16,0.197066,1.36216
64,16,131072,64,16,64,7,BF16,0.197154,1.36155
64,16,131072,64,16,64,8,BF16,0.197693,1.35784
64,16,131072,64,16,128,0,BF16,0.182749,1.46888
64,16,131072,64,16,128,2,BF16,0.358776,0.748198
64,16,131072,64,16,128,3,BF16,0.241099,1.11338
64,16,131072,64,16,128,4,BF16,0.18465,1.45376
64,16,131072,64,16,128,5,BF16,0.182712,1.46917
64,16,131072,64,16,128,6,BF16,0.18287,1.4679
64,16,131072,64,16,128,7,BF16,0.183789,1.46056
64,16,131072,64,16,128,8,BF16,0.183016,1.46673
64,16,131072,64,16,256,0,BF16,0.178646,1.50261
64,16,131072,64,16,256,2,BF16,0.267754,1.00255
64,16,131072,64,16,256,3,BF16,0.181714,1.47724
64,16,131072,64,16,256,4,BF16,0.178552,1.5034
64,16,131072,64,16,256,5,BF16,0.178694,1.5022
# BUILD_FAILED: 64,16,256,6,0
# BUILD_FAILED: 64,16,256,7,0
# BUILD_FAILED: 64,16,256,8,0
64,32,131072,64,32,16,0,BF16,0.765386,0.701439
64,32,131072,64,32,16,2,BF16,2.0317,0.264247
64,32,131072,64,32,16,3,BF16,1.35964,0.394863
64,32,131072,64,32,16,4,BF16,1.02161,0.525516
64,32,131072,64,32,16,5,BF16,0.826053,0.649923
64,32,131072,64,32,16,6,BF16,0.761538,0.704983
64,32,131072,64,32,16,7,BF16,0.767424,0.699575
64,32,131072,64,32,16,8,BF16,0.773419,0.694153
64,32,131072,64,32,32,0,BF16,0.385528,1.39256
64,32,131072,64,32,32,2,BF16,1.06795,0.502712
64,32,131072,64,32,32,3,BF16,0.715952,0.74987
64,32,131072,64,32,32,4,BF16,0.538779,0.996458
64,32,131072,64,32,32,5,BF16,0.434542,1.23549
64,32,131072,64,32,32,6,BF16,0.3846,1.39592
64,32,131072,64,32,32,7,BF16,0.387616,1.38506
64,32,131072,64,32,32,8,BF16,0.390626,1.37439
64,32,131072,64,32,64,0,BF16,0.197394,2.7198
64,32,131072,64,32,64,2,BF16,0.591074,0.908298
64,32,131072,64,32,64,3,BF16,0.396723,1.35326
64,32,131072,64,32,64,4,BF16,0.298776,1.7969
64,32,131072,64,32,64,5,BF16,0.242059,2.21793
64,32,131072,64,32,64,6,BF16,0.203357,2.64004
64,32,131072,64,32,64,7,BF16,0.197341,2.72053
64,32,131072,64,32,64,8,BF16,0.199163,2.69563
64,32,131072,64,32,128,0,BF16,0.187422,2.8645
64,32,131072,64,32,128,2,BF16,0.377299,1.42293
64,32,131072,64,32,128,3,BF16,0.255378,2.10226
64,32,131072,64,32,128,4,BF16,0.193715,2.77144
64,32,131072,64,32,128,5,BF16,0.187546,2.86262
64,32,131072,64,32,128,6,BF16,0.187464,2.86386
64,32,131072,64,32,128,7,BF16,0.187883,2.85747
64,32,131072,64,32,128,8,BF16,0.187459,2.86393
64,32,131072,64,32,256,0,BF16,0.183794,2.92105
64,32,131072,64,32,256,2,BF16,0.28588,1.87796
64,32,131072,64,32,256,3,BF16,0.192979,2.78201
64,32,131072,64,32,256,4,BF16,0.183787,2.92116
# BUILD_FAILED: 64,32,256,5,0
# BUILD_FAILED: 64,32,256,6,0
# BUILD_FAILED: 64,32,256,7,0
# BUILD_FAILED: 64,32,256,8,0
64,64,131072,64,64,16,0,BF16,0.812475,1.32157
64,64,131072,64,64,16,2,BF16,2.16165,0.496723
64,64,131072,64,64,16,3,BF16,1.44055,0.745371
64,64,131072,64,64,16,4,BF16,1.08559,0.989086
64,64,131072,64,64,16,5,BF16,0.870642,1.23328
64,64,131072,64,64,16,6,BF16,0.811693,1.32284
64,64,131072,64,64,16,7,BF16,0.811507,1.32315
64,64,131072,64,64,16,8,BF16,0.811621,1.32296
64,64,131072,64,64,32,0,BF16,0.410062,2.61848
64,64,131072,64,64,32,2,BF16,1.14699,0.93614
64,64,131072,64,64,32,3,BF16,0.76633,1.40115
64,64,131072,64,64,32,4,BF16,0.578024,1.85761
64,64,131072,64,64,32,5,BF16,0.463803,2.31508
64,64,131072,64,64,32,6,BF16,0.41008,2.61837
64,64,131072,64,64,32,7,BF16,0.410045,2.6186
64,64,131072,64,64,32,8,BF16,0.410107,2.6182
64,64,131072,64,64,64,0,BF16,0.214264,5.0113
64,64,131072,64,64,64,2,BF16,0.653648,1.64269
64,64,131072,64,64,64,3,BF16,0.434549,2.47093
64,64,131072,64,64,64,4,BF16,0.329754,3.25619
64,64,131072,64,64,64,5,BF16,0.265542,4.04358
64,64,131072,64,64,64,6,BF16,0.224411,4.78471
64,64,131072,64,64,64,7,BF16,0.213517,5.02884
64,64,131072,64,64,64,8,BF16,0.213307,5.03378
64,64,131072,64,64,128,0,BF16,0.214494,5.00592
64,64,131072,64,64,128,2,BF16,0.441875,2.42997
64,64,131072,64,64,128,3,BF16,0.295184,3.63753
64,64,131072,64,64,128,4,BF16,0.225018,4.77181
64,64,131072,64,64,128,5,BF16,0.21453,5.0051
64,64,131072,64,64,128,6,BF16,0.213931,5.0191
64,64,131072,64,64,128,7,BF16,0.21448,5.00626
# BUILD_FAILED: 64,64,128,8,0
64,64,131072,64,64,256,0,BF16,0.228861,4.69168
64,64,131072,64,64,256,2,BF16,0.338154,3.17531
64,64,131072,64,64,256,3,BF16,0.228766,4.69362
# BUILD_FAILED: 64,64,256,4,0
# BUILD_FAILED: 64,64,256,5,0
# BUILD_FAILED: 64,64,256,6,0
# BUILD_FAILED: 64,64,256,7,0
# BUILD_FAILED: 64,64,256,8,0
64,128,131072,64,128,16,0,BF16,1.21422,1.76861
64,128,131072,64,128,16,2,BF16,2.48892,0.862819
64,128,131072,64,128,16,3,BF16,1.6632,1.29117
64,128,131072,64,128,16,4,BF16,1.24872,1.71975
64,128,131072,64,128,16,5,BF16,1.21396,1.76899
64,128,131072,64,128,16,6,BF16,1.21415,1.76872
64,128,131072,64,128,16,7,BF16,1.21395,1.76901
64,128,131072,64,128,16,8,BF16,1.21405,1.76886
64,128,131072,64,128,32,0,BF16,0.611757,3.51036
64,128,131072,64,128,32,2,BF16,1.35723,1.58226
64,128,131072,64,128,32,3,BF16,0.908515,2.36373
64,128,131072,64,128,32,4,BF16,0.683349,3.14259
64,128,131072,64,128,32,5,BF16,0.611835,3.50991
64,128,131072,64,128,32,6,BF16,0.61185,3.50982
64,128,131072,64,128,32,7,BF16,0.61188,3.50965
64,128,131072,64,128,32,8,BF16,0.611822,3.50998
64,128,131072,64,128,64,0,BF16,0.410974,5.22535
64,128,131072,64,128,64,2,BF16,0.79535,2.70005
64,128,131072,64,128,64,3,BF16,0.533936,4.02199
64,128,131072,64,128,64,4,BF16,0.41105,5.22439
64,128,131072,64,128,64,5,BF16,0.411032,5.22461
64,128,131072,64,128,64,6,BF16,0.411082,5.22398
64,128,131072,64,128,64,7,BF16,0.411179,5.22274
64,128,131072,64,128,64,8,BF16,0.411202,5.22246
64,128,131072,64,128,128,0,BF16,0.411064,5.22421
64,128,131072,64,128,128,2,BF16,0.584301,3.6753
64,128,131072,64,128,128,3,BF16,0.411032,5.22461
64,128,131072,64,128,128,4,BF16,0.411174,5.22281
# BUILD_FAILED: 64,128,128,5,0
# BUILD_FAILED: 64,128,128,6,0
# BUILD_FAILED: 64,128,128,7,0
# BUILD_FAILED: 64,128,128,8,0
64,128,131072,64,128,256,0,BF16,0.490352,4.37947
64,128,131072,64,128,256,2,BF16,0.49019,4.38092
# BUILD_FAILED: 64,128,256,3,0
# BUILD_FAILED: 64,128,256,4,0
# BUILD_FAILED: 64,128,256,5,0
# BUILD_FAILED: 64,128,256,6,0
# BUILD_FAILED: 64,128,256,7,0
# BUILD_FAILED: 64,128,256,8,0
64,192,131072,64,192,16,0,BF16,1.61748,1.99151
64,192,131072,64,192,16,2,BF16,3.37303,0.954993
64,192,131072,64,192,16,3,BF16,2.39876,1.34287
64,192,131072,64,192,16,4,BF16,2.01284,1.60034
64,192,131072,64,192,16,5,BF16,1.64795,1.95468
64,192,131072,64,192,16,6,BF16,1.61738,1.99163
64,192,131072,64,192,16,7,BF16,1.61729,1.99174
64,192,131072,64,192,16,8,BF16,1.61753,1.99144
64,192,131072,64,192,32,0,BF16,0.814294,3.95585
64,192,131072,64,192,32,2,BF16,2.1698,1.48457
64,192,131072,64,192,32,3,BF16,1.29443,2.48854
64,192,131072,64,192,32,4,BF16,1.09559,2.94017
64,192,131072,64,192,32,5,BF16,0.878893,3.66509
64,192,131072,64,192,32,6,BF16,0.814619,3.95427
64,192,131072,64,192,32,7,BF16,0.814326,3.95569
64,192,131072,64,192,32,8,BF16,0.814302,3.95581
64,192,131072,64,192,64,0,BF16,0.612947,5.25531
64,192,131072,64,192,64,2,BF16,1.24953,2.57796
64,192,131072,64,192,64,3,BF16,0.842402,3.82386
64,192,131072,64,192,64,4,BF16,0.649307,4.96102
64,192,131072,64,192,64,5,BF16,0.612851,5.25613
64,192,131072,64,192,64,6,BF16,0.61279,5.25665
64,192,131072,64,192,64,7,BF16,0.612837,5.25625
# BUILD_FAILED: 64,192,64,8,0
64,192,131072,64,192,128,0,BF16,0.61804,5.212
64,192,131072,64,192,128,2,BF16,0.887608,3.62911
64,192,131072,64,192,128,3,BF16,0.617875,5.21339
# BUILD_FAILED: 64,192,128,4,0
# BUILD_FAILED: 64,192,128,5,0
# BUILD_FAILED: 64,192,128,6,0
# BUILD_FAILED: 64,192,128,7,0
# BUILD_FAILED: 64,192,128,8,0
# BUILD_FAILED: 64,192,256,0,0
# BUILD_FAILED: 64,192,256,2,0
# BUILD_FAILED: 64,192,256,3,0
# BUILD_FAILED: 64,192,256,4,0
# BUILD_FAILED: 64,192,256,5,0
# BUILD_FAILED: 64,192,256,6,0
# BUILD_FAILED: 64,192,256,7,0
# BUILD_FAILED: 64,192,256,8,0
64,256,131072,64,256,16,0,BF16,2.14596,2.00142
64,256,131072,64,256,16,2,BF16,3.84515,1.11698
64,256,131072,64,256,16,3,BF16,2.82222,1.52184
64,256,131072,64,256,16,4,BF16,2.26246,1.89836
64,256,131072,64,256,16,5,BF16,2.14579,2.00158
64,256,131072,64,256,16,6,BF16,2.14584,2.00154
64,256,131072,64,256,16,7,BF16,2.14581,2.00156
64,256,131072,64,256,16,8,BF16,2.14573,2.00163
64,256,131072,64,256,32,0,BF16,1.0792,3.97978
64,256,131072,64,256,32,2,BF16,2.48031,1.73163
64,256,131072,64,256,32,3,BF16,1.51756,2.83018
64,256,131072,64,256,32,4,BF16,1.25585,3.41996
64,256,131072,64,256,32,5,BF16,1.08001,3.97677
64,256,131072,64,256,32,6,BF16,1.07915,3.97997
64,256,131072,64,256,32,7,BF16,1.07926,3.97953
64,256,131072,64,256,32,8,BF16,1.07926,3.97956
64,256,131072,64,256,64,0,BF16,0.815674,5.26555
64,256,131072,64,256,64,2,BF16,1.4542,2.95349
64,256,131072,64,256,64,3,BF16,0.989355,4.34118
64,256,131072,64,256,64,4,BF16,0.816654,5.25922
64,256,131072,64,256,64,5,BF16,0.815778,5.26488
# BUILD_FAILED: 64,256,64,6,0
# BUILD_FAILED: 64,256,64,7,0
# BUILD_FAILED: 64,256,64,8,0
64,256,131072,64,256,128,0,BF16,1.08165,3.97074
64,256,131072,64,256,128,2,BF16,1.08244,3.96785
# BUILD_FAILED: 64,256,128,3,0
# BUILD_FAILED: 64,256,128,4,0
# BUILD_FAILED: 64,256,128,5,0
# BUILD_FAILED: 64,256,128,6,0
# BUILD_FAILED: 64,256,128,7,0
# BUILD_FAILED: 64,256,128,8,0
# BUILD_FAILED: 64,256,256,0,0
# BUILD_FAILED: 64,256,256,2,0
# BUILD_FAILED: 64,256,256,3,0
# BUILD_FAILED: 64,256,256,4,0
# BUILD_FAILED: 64,256,256,5,0
# BUILD_FAILED: 64,256,256,6,0
# BUILD_FAILED: 64,256,256,7,0
# BUILD_FAILED: 64,256,256,8,0
128,16,131072,128,16,16,0,BF16,0.912923,0.588079
128,16,131072,128,16,16,2,BF16,2.18919,0.245238
128,16,131072,128,16,16,3,BF16,1.46471,0.366537
128,16,131072,128,16,16,4,BF16,1.09852,0.488721
128,16,131072,128,16,16,5,BF16,0.91184,0.588778
128,16,131072,128,16,16,6,BF16,0.911581,0.588945
128,16,131072,128,16,16,7,BF16,0.911528,0.588979
128,16,131072,128,16,16,8,BF16,0.911714,0.588859
128,16,131072,128,16,32,0,BF16,0.459301,1.16889
128,16,131072,128,16,32,2,BF16,1.16962,0.459013
128,16,131072,128,16,32,3,BF16,0.783269,0.685424
128,16,131072,128,16,32,4,BF16,0.588902,0.911647
128,16,131072,128,16,32,5,BF16,0.474038,1.13255
128,16,131072,128,16,32,6,BF16,0.459302,1.16888
128,16,131072,128,16,32,7,BF16,0.459176,1.16921
128,16,131072,128,16,32,8,BF16,0.459397,1.16864
128,16,131072,128,16,64,0,BF16,0.252446,2.12667
128,16,131072,128,16,64,2,BF16,0.668954,0.802553
128,16,131072,128,16,64,3,BF16,0.447954,1.1985
128,16,131072,128,16,64,4,BF16,0.338344,1.58676
128,16,131072,128,16,64,5,BF16,0.27389,1.96017
128,16,131072,128,16,64,6,BF16,0.252437,2.12675
128,16,131072,128,16,64,7,BF16,0.252475,2.12643
128,16,131072,128,16,64,8,BF16,0.252331,2.12764
128,16,131072,128,16,128,0,BF16,0.257325,2.08636
128,16,131072,128,16,128,2,BF16,0.462942,1.15969
128,16,131072,128,16,128,3,BF16,0.310019,1.73173
128,16,131072,128,16,128,4,BF16,0.257547,2.08455
128,16,131072,128,16,128,5,BF16,0.257413,2.08564
128,16,131072,128,16,128,6,BF16,0.257491,2.08501
# BUILD_FAILED: 128,16,128,7,0
# BUILD_FAILED: 128,16,128,8,0
128,16,131072,128,16,256,0,BF16,0.266758,2.01257
128,16,131072,128,16,256,2,BF16,0.36897,1.45505
128,16,131072,128,16,256,3,BF16,0.266701,2.01301
# BUILD_FAILED: 128,16,256,4,0
# BUILD_FAILED: 128,16,256,5,0
# BUILD_FAILED: 128,16,256,6,0
# BUILD_FAILED: 128,16,256,7,0
# BUILD_FAILED: 128,16,256,8,0
128,32,131072,128,32,16,0,BF16,1.0127,1.06027
128,32,131072,128,32,16,2,BF16,2.26083,0.474933
128,32,131072,128,32,16,3,BF16,1.5105,0.710854
128,32,131072,128,32,16,4,BF16,1.13454,0.946412
128,32,131072,128,32,16,5,BF16,1.01266,1.06032
128,32,131072,128,32,16,6,BF16,1.01223,1.06077
128,32,131072,128,32,16,7,BF16,1.01227,1.06072
128,32,131072,128,32,16,8,BF16,1.01219,1.06081
128,32,131072,128,32,32,0,BF16,0.510405,2.10371
128,32,131072,128,32,32,2,BF16,1.20794,0.8889
128,32,131072,128,32,32,3,BF16,0.809658,1.32617
128,32,131072,128,32,32,4,BF16,0.608112,1.7657
128,32,131072,128,32,32,5,BF16,0.510962,2.10141
128,32,131072,128,32,32,6,BF16,0.510389,2.10377
128,32,131072,128,32,32,7,BF16,0.510403,2.10371
128,32,131072,128,32,32,8,BF16,0.510392,2.10376
128,32,131072,128,32,64,0,BF16,0.265709,4.04105
128,32,131072,128,32,64,2,BF16,0.698086,1.53812
128,32,131072,128,32,64,3,BF16,0.465338,2.30745
128,32,131072,128,32,64,4,BF16,0.352677,3.04455
128,32,131072,128,32,64,5,BF16,0.28515,3.76553
128,32,131072,128,32,64,6,BF16,0.264686,4.05666
128,32,131072,128,32,64,7,BF16,0.264643,4.05732
128,32,131072,128,32,64,8,BF16,0.265218,4.04853
128,32,131072,128,32,128,0,BF16,0.26495,4.05261
128,32,131072,128,32,128,2,BF16,0.489635,2.19294
128,32,131072,128,32,128,3,BF16,0.327334,3.28026
128,32,131072,128,32,128,4,BF16,0.264766,4.05543
128,32,131072,128,32,128,5,BF16,0.264725,4.05607
# BUILD_FAILED: 128,32,128,6,0
# BUILD_FAILED: 128,32,128,7,0
# BUILD_FAILED: 128,32,128,8,0
128,32,131072,128,32,256,0,BF16,0.38953,2.75651
128,32,131072,128,32,256,2,BF16,0.389544,2.75641
# BUILD_FAILED: 128,32,256,3,0
# BUILD_FAILED: 128,32,256,4,0
# BUILD_FAILED: 128,32,256,5,0
# BUILD_FAILED: 128,32,256,6,0
# BUILD_FAILED: 128,32,256,7,0
# BUILD_FAILED: 128,32,256,8,0
128,64,131072,128,64,16,0,BF16,1.21406,1.76884
128,64,131072,128,64,16,2,BF16,2.43923,0.880396
128,64,131072,128,64,16,3,BF16,1.6263,1.32047
128,64,131072,128,64,16,4,BF16,1.22591,1.75175
128,64,131072,128,64,16,5,BF16,1.21397,1.76897
128,64,131072,128,64,16,6,BF16,1.21408,1.76882
128,64,131072,128,64,16,7,BF16,1.21409,1.76879
128,64,131072,128,64,16,8,BF16,1.21413,1.76874
128,64,131072,128,64,32,0,BF16,0.611901,3.50953
128,64,131072,128,64,32,2,BF16,1.30688,1.64321
128,64,131072,128,64,32,3,BF16,0.87437,2.45604
128,64,131072,128,64,32,4,BF16,0.660171,3.25292
128,64,131072,128,64,32,5,BF16,0.611546,3.51157
128,64,131072,128,64,32,6,BF16,0.611806,3.51007
128,64,131072,128,64,32,7,BF16,0.611661,3.51091
128,64,131072,128,64,32,8,BF16,0.611842,3.50987
128,64,131072,128,64,64,0,BF16,0.317752,6.75836
128,64,131072,128,64,64,2,BF16,0.762002,2.81821
128,64,131072,128,64,64,3,BF16,0.508054,4.22688
128,64,131072,128,64,64,4,BF16,0.385499,5.57066
128,64,131072,128,64,64,5,BF16,0.31783,6.7567
128,64,131072,128,64,64,6,BF16,0.317069,6.77293
128,64,131072,128,64,64,7,BF16,0.31732,6.76756
128,64,131072,128,64,64,8,BF16,0.318218,6.74848
128,64,131072,128,64,128,0,BF16,0.31729,6.76821
128,64,131072,128,64,128,2,BF16,0.546485,3.92963
128,64,131072,128,64,128,3,BF16,0.36453,5.89111
128,64,131072,128,64,128,4,BF16,0.317283,6.76835
# BUILD_FAILED: 128,64,128,5,0
# BUILD_FAILED: 128,64,128,6,0
# BUILD_FAILED: 128,64,128,7,0
# BUILD_FAILED: 128,64,128,8,0
128,64,131072,128,64,256,0,BF16,0.446974,4.80449
128,64,131072,128,64,256,2,BF16,0.447142,4.80268
# BUILD_FAILED: 128,64,256,3,0
# BUILD_FAILED: 128,64,256,4,0
# BUILD_FAILED: 128,64,256,5,0
# BUILD_FAILED: 128,64,256,6,0
# BUILD_FAILED: 128,64,256,7,0
# BUILD_FAILED: 128,64,256,8,0
128,128,131072,128,128,16,0,BF16,1.61805,2.65441
128,128,131072,128,128,16,2,BF16,3.33303,1.28861
128,128,131072,128,128,16,3,BF16,2.3799,1.80468
128,128,131072,128,128,16,4,BF16,1.98754,2.16095
128,128,131072,128,128,16,5,BF16,1.64252,2.61486
128,128,131072,128,128,16,6,BF16,1.61852,2.65363
128,128,131072,128,128,16,7,BF16,1.61786,2.65472
128,128,131072,128,128,16,8,BF16,1.61761,2.65513
128,128,131072,128,128,32,0,BF16,0.81489,5.27061
128,128,131072,128,128,32,2,BF16,2.12756,2.01873
128,128,131072,128,128,32,3,BF16,1.26282,3.40109
128,128,131072,128,128,32,4,BF16,1.0738,3.99977
128,128,131072,128,128,32,5,BF16,0.86404,4.9708
128,128,131072,128,128,32,6,BF16,0.815258,5.26823
128,128,131072,128,128,32,7,BF16,0.81444,5.27352
128,128,131072,128,128,32,8,BF16,0.814608,5.27243
128,128,131072,128,128,64,0,BF16,0.422674,10.1614
128,128,131072,128,128,64,2,BF16,1.16424,3.68907
128,128,131072,128,128,64,3,BF16,0.786064,5.46389
128,128,131072,128,128,64,4,BF16,0.59989,7.1596
128,128,131072,128,128,64,5,BF16,0.491544,8.73771
128,128,131072,128,128,64,6,BF16,0.429171,10.0076
128,128,131072,128,128,64,7,BF16,0.42248,10.1661
# BUILD_FAILED: 128,128,64,8,0
128,128,131072,128,128,128,0,BF16,0.54364,7.90039
128,128,131072,128,128,128,2,BF16,0.800806,5.3633
128,128,131072,128,128,128,3,BF16,0.542939,7.91059
# BUILD_FAILED: 128,128,128,4,0
# BUILD_FAILED: 128,128,128,5,0
# BUILD_FAILED: 128,128,128,6,0
# BUILD_FAILED: 128,128,128,7,0
# BUILD_FAILED: 128,128,128,8,0
# BUILD_FAILED: 128,128,256,0,0
# BUILD_FAILED: 128,128,256,2,0
# BUILD_FAILED: 128,128,256,3,0
# BUILD_FAILED: 128,128,256,4,0
# BUILD_FAILED: 128,128,256,5,0
# BUILD_FAILED: 128,128,256,6,0
# BUILD_FAILED: 128,128,256,7,0
# BUILD_FAILED: 128,128,256,8,0
128,192,131072,128,192,16,0,BF16,2.14729,3.00028
128,192,131072,128,192,16,2,BF16,3.78866,1.70046
128,192,131072,128,192,16,3,BF16,2.78403,2.31407
128,192,131072,128,192,16,4,BF16,2.23484,2.88274
128,192,131072,128,192,16,5,BF16,2.14774,2.99965
128,192,131072,128,192,16,6,BF16,2.1473,3.00026
128,192,131072,128,192,16,7,BF16,2.14721,3.00038
128,192,131072,128,192,16,8,BF16,2.14717,3.00043
128,192,131072,128,192,32,0,BF16,1.08021,5.96405
128,192,131072,128,192,32,2,BF16,2.4043,2.67955
128,192,131072,128,192,32,3,BF16,1.46736,4.3905
128,192,131072,128,192,32,4,BF16,1.22239,5.27037
128,192,131072,128,192,32,5,BF16,1.08085,5.96053
128,192,131072,128,192,32,6,BF16,1.0802,5.96413
128,192,131072,128,192,32,7,BF16,1.08022,5.96403
128,192,131072,128,192,32,8,BF16,1.08028,5.96368
128,192,131072,128,192,64,0,BF16,0.616914,10.443
128,192,131072,128,192,64,2,BF16,1.37461,4.68675
128,192,131072,128,192,64,3,BF16,0.925005,6.96478
128,192,131072,128,192,64,4,BF16,0.707154,9.1104
128,192,131072,128,192,64,5,BF16,0.616893,10.4434
# BUILD_FAILED: 128,192,64,6,0
# BUILD_FAILED: 128,192,64,7,0
# BUILD_FAILED: 128,192,64,8,0
128,192,131072,128,192,128,0,BF16,0.977235,6.59253
128,192,131072,128,192,128,2,BF16,0.977222,6.59261
# BUILD_FAILED: 128,192,128,3,0
# BUILD_FAILED: 128,192,128,4,0
# BUILD_FAILED: 128,192,128,5,0
# BUILD_FAILED: 128,192,128,6,0
# BUILD_FAILED: 128,192,128,7,0
# BUILD_FAILED: 128,192,128,8,0
# BUILD_FAILED: 128,192,256,0,0
# BUILD_FAILED: 128,192,256,2,0
# BUILD_FAILED: 128,192,256,3,0
# BUILD_FAILED: 128,192,256,4,0
# BUILD_FAILED: 128,192,256,5,0
# BUILD_FAILED: 128,192,256,6,0
# BUILD_FAILED: 128,192,256,7,0
# BUILD_FAILED: 128,192,256,8,0
128,256,131072,128,256,16,0,BF16,2.57585,3.33479
128,256,131072,128,256,16,2,BF16,4.14323,2.07325
128,256,131072,128,256,16,3,BF16,3.06466,2.8029
128,256,131072,128,256,16,4,BF16,2.57753,3.33263
128,256,131072,128,256,16,5,BF16,2.57584,3.33481
128,256,131072,128,256,16,6,BF16,2.57584,3.33481
128,256,131072,128,256,16,7,BF16,2.57578,3.33489
128,256,131072,128,256,16,8,BF16,2.57581,3.33485
128,256,131072,128,256,32,0,BF16,1.29539,6.63116
128,256,131072,128,256,32,2,BF16,2.63639,3.25821
128,256,131072,128,256,32,3,BF16,1.65119,5.20227
128,256,131072,128,256,32,4,BF16,1.34954,6.36509
128,256,131072,128,256,32,5,BF16,1.29543,6.63097
128,256,131072,128,256,32,6,BF16,1.29552,6.63047
128,256,131072,128,256,32,7,BF16,1.29556,6.63029
128,256,131072,128,256,32,8,BF16,1.29535,6.63135
128,256,131072,128,256,64,0,BF16,0.821312,10.4588
128,256,131072,128,256,64,2,BF16,1.53739,5.58735
128,256,131072,128,256,64,3,BF16,1.03829,8.27318
128,256,131072,128,256,64,4,BF16,0.821251,10.4596
# BUILD_FAILED: 128,256,64,5,0
# BUILD_FAILED: 128,256,64,6,0
# BUILD_FAILED: 128,256,64,7,0
# BUILD_FAILED: 128,256,64,8,0
128,256,131072,128,256,128,0,BF16,1.13084,7.59608
128,256,131072,128,256,128,2,BF16,1.13084,7.59603
# BUILD_FAILED: 128,256,128,3,0
# BUILD_FAILED: 128,256,128,4,0
# BUILD_FAILED: 128,256,128,5,0
# BUILD_FAILED: 128,256,128,6,0
# BUILD_FAILED: 128,256,128,7,0
# BUILD_FAILED: 128,256,128,8,0
# BUILD_FAILED: 128,256,256,0,0
# BUILD_FAILED: 128,256,256,2,0
# BUILD_FAILED: 128,256,256,3,0
# BUILD_FAILED: 128,256,256,4,0
# BUILD_FAILED: 128,256,256,5,0
# BUILD_FAILED: 128,256,256,6,0
# BUILD_FAILED: 128,256,256,7,0
# BUILD_FAILED: 128,256,256,8,0
64,16,131072,64,16,32,0,FP8_E4M3,0.370126,0.725253
64,16,131072,64,16,32,2,FP8_E4M3,0.971922,0.27619
64,16,131072,64,16,32,3,FP8_E4M3,0.651581,0.411976
64,16,131072,64,16,32,4,FP8_E4M3,0.490522,0.547245
64,16,131072,64,16,32,5,FP8_E4M3,0.396874,0.676375
64,16,131072,64,16,32,6,FP8_E4M3,0.36201,0.741515
64,16,131072,64,16,32,7,FP8_E4M3,0.36493,0.735581
64,16,131072,64,16,32,8,FP8_E4M3,0.368232,0.728985
64,16,131072,64,16,64,0,FP8_E4M3,0.18649,1.43941
64,16,131072,64,16,64,2,FP8_E4M3,0.511875,0.524416
64,16,131072,64,16,64,3,FP8_E4M3,0.344443,0.779332
64,16,131072,64,16,64,4,FP8_E4M3,0.260739,1.02952
64,16,131072,64,16,64,5,FP8_E4M3,0.21073,1.27384
64,16,131072,64,16,64,6,FP8_E4M3,0.184782,1.45271
64,16,131072,64,16,64,7,FP8_E4M3,0.186035,1.44293
64,16,131072,64,16,64,8,FP8_E4M3,0.187986,1.42796
64,16,131072,64,16,128,0,FP8_E4M3,0.102747,2.61258
64,16,131072,64,16,128,2,FP8_E4M3,0.283352,0.947357
64,16,131072,64,16,128,3,FP8_E4M3,0.191944,1.39851
64,16,131072,64,16,128,4,FP8_E4M3,0.145872,1.84021
64,16,131072,64,16,128,5,FP8_E4M3,0.119272,2.25062
64,16,131072,64,16,128,6,FP8_E4M3,0.102096,2.62925
64,16,131072,64,16,128,7,FP8_E4M3,0.102821,2.61071
64,16,131072,64,16,128,8,FP8_E4M3,0.101808,2.63668
64,16,131072,64,16,256,0,FP8_E4M3,0.0951584,2.82093
64,16,131072,64,16,256,2,FP8_E4M3,0.183064,1.46635
64,16,131072,64,16,256,3,FP8_E4M3,0.124418,2.15754
64,16,131072,64,16,256,4,FP8_E4M3,0.095752,2.80344
64,16,131072,64,16,256,5,FP8_E4M3,0.0951776,2.82036
64,16,131072,64,16,256,6,FP8_E4M3,0.0951712,2.82055
64,16,131072,64,16,256,7,FP8_E4M3,0.0956336,2.80692
64,16,131072,64,16,256,8,FP8_E4M3,0.0955008,2.81082
64,16,131072,64,16,512,0,FP8_E4M3,0.0931584,2.88149
64,16,131072,64,16,512,2,FP8_E4M3,0.137781,1.94828
64,16,131072,64,16,512,3,FP8_E4M3,0.0946032,2.83749
64,16,131072,64,16,512,4,FP8_E4M3,0.0929056,2.88934
64,16,131072,64,16,512,5,FP8_E4M3,0.09344,2.87281
# BUILD_FAILED: 64,16,512,6,1
# BUILD_FAILED: 64,16,512,7,1
# BUILD_FAILED: 64,16,512,8,1
64,32,131072,64,32,32,0,FP8_E4M3,0.387662,1.38489
64,32,131072,64,32,32,2,FP8_E4M3,1.0209,0.52588
64,32,131072,64,32,32,3,FP8_E4M3,0.684419,0.784418
64,32,131072,64,32,32,4,FP8_E4M3,0.515395,1.04167
64,32,131072,64,32,32,5,FP8_E4M3,0.417102,1.28714
64,32,131072,64,32,32,6,FP8_E4M3,0.384349,1.39683
64,32,131072,64,32,32,7,FP8_E4M3,0.387667,1.38488
64,32,131072,64,32,32,8,FP8_E4M3,0.390558,1.37462
64,32,131072,64,32,64,0,FP8_E4M3,0.197109,2.72373
64,32,131072,64,32,64,2,FP8_E4M3,0.537899,0.998088
64,32,131072,64,32,64,3,FP8_E4M3,0.362114,1.4826
64,32,131072,64,32,64,4,FP8_E4M3,0.273422,1.96352
64,32,131072,64,32,64,5,FP8_E4M3,0.221662,2.42202
64,32,131072,64,32,64,6,FP8_E4M3,0.195952,2.73981
64,32,131072,64,32,64,7,FP8_E4M3,0.197125,2.72351
64,32,131072,64,32,64,8,FP8_E4M3,0.199144,2.69589
64,32,131072,64,32,128,0,FP8_E4M3,0.102803,5.22232
64,32,131072,64,32,128,2,FP8_E4M3,0.299235,1.79414
64,32,131072,64,32,128,3,FP8_E4M3,0.202123,2.65616
64,32,131072,64,32,128,4,FP8_E4M3,0.153267,3.50284
64,32,131072,64,32,128,5,FP8_E4M3,0.124461,4.31357
64,32,131072,64,32,128,6,FP8_E4M3,0.105283,5.0993
64,32,131072,64,32,128,7,FP8_E4M3,0.102736,5.22573
64,32,131072,64,32,128,8,FP8_E4M3,0.103182,5.20312
64,32,131072,64,32,256,0,FP8_E4M3,0.0980432,5.47586
64,32,131072,64,32,256,2,FP8_E4M3,0.192949,2.78245
64,32,131072,64,32,256,3,FP8_E4M3,0.131549,4.08115
64,32,131072,64,32,256,4,FP8_E4M3,0.10088,5.32188
64,32,131072,64,32,256,5,FP8_E4M3,0.097816,5.48858
64,32,131072,64,32,256,6,FP8_E4M3,0.0977296,5.49343
64,32,131072,64,32,256,7,FP8_E4M3,0.0977792,5.49065
64,32,131072,64,32,256,8,FP8_E4M3,0.0978576,5.48625
64,32,131072,64,32,512,0,FP8_E4M3,0.0956416,5.61336
64,32,131072,64,32,512,2,FP8_E4M3,0.146725,3.65903
64,32,131072,64,32,512,3,FP8_E4M3,0.100725,5.33008
64,32,131072,64,32,512,4,FP8_E4M3,0.095648,5.61299
# BUILD_FAILED: 64,32,512,5,1
# BUILD_FAILED: 64,32,512,6,1
# BUILD_FAILED: 64,32,512,7,1
# BUILD_FAILED: 64,32,512,8,1
64,64,131072,64,64,32,0,FP8_E4M3,0.41067,2.61461
64,64,131072,64,64,32,2,FP8_E4M3,1.08736,0.987473
64,64,131072,64,64,32,3,FP8_E4M3,0.725416,1.48017
64,64,131072,64,64,32,4,FP8_E4M3,0.548267,1.95843
64,64,131072,64,64,32,5,FP8_E4M3,0.44032,2.43855
64,64,131072,64,64,32,6,FP8_E4M3,0.410235,2.61738
64,64,131072,64,64,32,7,FP8_E4M3,0.410005,2.61885
64,64,131072,64,64,32,8,FP8_E4M3,0.40991,2.61946
64,64,131072,64,64,64,0,FP8_E4M3,0.209251,5.13135
64,64,131072,64,64,64,2,FP8_E4M3,0.579147,1.854
64,64,131072,64,64,64,3,FP8_E4M3,0.38869,2.76247
64,64,131072,64,64,64,4,FP8_E4M3,0.29325,3.66153
64,64,131072,64,64,64,5,FP8_E4M3,0.236622,4.53779
64,64,131072,64,64,64,6,FP8_E4M3,0.208738,5.14398
64,64,131072,64,64,64,7,FP8_E4M3,0.20893,5.13925
64,64,131072,64,64,64,8,FP8_E4M3,0.208738,5.14398
64,64,131072,64,64,128,0,FP8_E4M3,0.110966,9.67628
64,64,131072,64,64,128,2,FP8_E4M3,0.331832,3.2358
64,64,131072,64,64,128,3,FP8_E4M3,0.221669,4.8439
64,64,131072,64,64,128,4,FP8_E4M3,0.16968,6.32804
64,64,131072,64,64,128,5,FP8_E4M3,0.13699,7.83808
64,64,131072,64,64,128,6,FP8_E4M3,0.116274,9.23461
64,64,131072,64,64,128,7,FP8_E4M3,0.111002,9.67321
64,64,131072,64,64,128,8,FP8_E4M3,0.111002,9.67321
64,64,131072,64,64,256,0,FP8_E4M3,0.111032,9.67056
64,64,131072,64,64,256,2,FP8_E4M3,0.225173,4.76852
64,64,131072,64,64,256,3,FP8_E4M3,0.152011,7.06357
64,64,131072,64,64,256,4,FP8_E4M3,0.117352,9.14975
64,64,131072,64,64,256,5,FP8_E4M3,0.111154,9.65998
64,64,131072,64,64,256,6,FP8_E4M3,0.11109,9.66555
64,64,131072,64,64,256,7,FP8_E4M3,0.111102,9.66443
# BUILD_FAILED: 64,64,256,8,1
64,64,131072,64,64,512,0,FP8_E4M3,0.118491,9.06179
64,64,131072,64,64,512,2,FP8_E4M3,0.173389,6.19268
64,64,131072,64,64,512,3,FP8_E4M3,0.119066,9.01807
# BUILD_FAILED: 64,64,512,4,1
# BUILD_FAILED: 64,64,512,5,1
# BUILD_FAILED: 64,64,512,6,1
# BUILD_FAILED: 64,64,512,7,1
# BUILD_FAILED: 64,64,512,8,1
64,128,131072,64,128,32,0,FP8_E4M3,0.611805,3.51008
64,128,131072,64,128,32,2,FP8_E4M3,1.24598,1.72354
64,128,131072,64,128,32,3,FP8_E4M3,0.834483,2.57343
64,128,131072,64,128,32,4,FP8_E4M3,0.630586,3.40554
64,128,131072,64,128,32,5,FP8_E4M3,0.611645,3.511
64,128,131072,64,128,32,6,FP8_E4M3,0.61184,3.50988
64,128,131072,64,128,32,7,FP8_E4M3,0.611878,3.50966
64,128,131072,64,128,32,8,FP8_E4M3,0.611808,3.51006
64,128,131072,64,128,64,0,FP8_E4M3,0.31059,6.9142
64,128,131072,64,128,64,2,FP8_E4M3,0.681325,3.15192
64,128,131072,64,128,64,3,FP8_E4M3,0.457483,4.69413
64,128,131072,64,128,64,4,FP8_E4M3,0.345376,6.21781
64,128,131072,64,128,64,5,FP8_E4M3,0.309851,6.93069
64,128,131072,64,128,64,6,FP8_E4M3,0.309872,6.93023
64,128,131072,64,128,64,7,FP8_E4M3,0.309973,6.92797
64,128,131072,64,128,64,8,FP8_E4M3,0.309933,6.92887
64,128,131072,64,128,128,0,FP8_E4M3,0.209746,10.2385
64,128,131072,64,128,128,2,FP8_E4M3,0.401677,5.3463
64,128,131072,64,128,128,3,FP8_E4M3,0.270765,7.93118
64,128,131072,64,128,128,4,FP8_E4M3,0.20969,10.2413
64,128,131072,64,128,128,5,FP8_E4M3,0.209717,10.2399
64,128,131072,64,128,128,6,FP8_E4M3,0.209571,10.247
64,128,131072,64,128,128,7,FP8_E4M3,0.209901,10.2309
64,128,131072,64,128,128,8,FP8_E4M3,0.209946,10.2288
64,128,131072,64,128,256,0,FP8_E4M3,0.210227,10.2151
64,128,131072,64,128,256,2,FP8_E4M3,0.296685,7.23827
64,128,131072,64,128,256,3,FP8_E4M3,0.210309,10.2111
64,128,131072,64,128,256,4,FP8_E4M3,0.21041,10.2062
# BUILD_FAILED: 64,128,256,5,1
# BUILD_FAILED: 64,128,256,6,1
# BUILD_FAILED: 64,128,256,7,1
# BUILD_FAILED: 64,128,256,8,1
64,128,131072,64,128,512,0,FP8_E4M3,0.24997,8.59098
64,128,131072,64,128,512,2,FP8_E4M3,0.250022,8.58916
# BUILD_FAILED: 64,128,512,3,1
# BUILD_FAILED: 64,128,512,4,1
# BUILD_FAILED: 64,128,512,5,1
# BUILD_FAILED: 64,128,512,6,1
# BUILD_FAILED: 64,128,512,7,1
# BUILD_FAILED: 64,128,512,8,1
64,192,131072,64,192,32,0,FP8_E4M3,0.81372,3.95864
64,192,131072,64,192,32,2,FP8_E4M3,1.39643,2.30675
64,192,131072,64,192,32,3,FP8_E4M3,0.935949,3.44167
64,192,131072,64,192,32,4,FP8_E4M3,0.813651,3.95898
64,192,131072,64,192,32,5,FP8_E4M3,0.813635,3.95905
64,192,131072,64,192,32,6,FP8_E4M3,0.813672,3.95887
64,192,131072,64,192,32,7,FP8_E4M3,0.81364,3.95903
64,192,131072,64,192,32,8,FP8_E4M3,0.813571,3.95937
64,192,131072,64,192,64,0,FP8_E4M3,0.412192,7.81487
64,192,131072,64,192,64,2,FP8_E4M3,0.781717,4.12071
64,192,131072,64,192,64,3,FP8_E4M3,0.525528,6.1295
64,192,131072,64,192,64,4,FP8_E4M3,0.412219,7.81435
64,192,131072,64,192,64,5,FP8_E4M3,0.412117,7.81629
64,192,131072,64,192,64,6,FP8_E4M3,0.41213,7.81605
64,192,131072,64,192,64,7,FP8_E4M3,0.412141,7.81584
64,192,131072,64,192,64,8,FP8_E4M3,0.412067,7.81723
64,192,131072,64,192,128,0,FP8_E4M3,0.31163,10.3367
64,192,131072,64,192,128,2,FP8_E4M3,0.477549,6.74533
64,192,131072,64,192,128,3,FP8_E4M3,0.32113,10.0309
64,192,131072,64,192,128,4,FP8_E4M3,0.311578,10.3384
64,192,131072,64,192,128,5,FP8_E4M3,0.311702,10.3343
64,192,131072,64,192,128,6,FP8_E4M3,0.311638,10.3364
64,192,131072,64,192,128,7,FP8_E4M3,0.311752,10.3327
# BUILD_FAILED: 64,192,128,8,1
64,192,131072,64,192,256,0,FP8_E4M3,0.311674,10.3353
64,192,131072,64,192,256,2,FP8_E4M3,0.371094,8.68034
64,192,131072,64,192,256,3,FP8_E4M3,0.311816,10.3305
# BUILD_FAILED: 64,192,256,4,1
# BUILD_FAILED: 64,192,256,5,1
# BUILD_FAILED: 64,192,256,6,1
# BUILD_FAILED: 64,192,256,7,1
# BUILD_FAILED: 64,192,256,8,1
# BUILD_FAILED: 64,192,512,0,1
# BUILD_FAILED: 64,192,512,2,1
# BUILD_FAILED: 64,192,512,3,1
# BUILD_FAILED: 64,192,512,4,1
# BUILD_FAILED: 64,192,512,5,1
# BUILD_FAILED: 64,192,512,6,1
# BUILD_FAILED: 64,192,512,7,1
# BUILD_FAILED: 64,192,512,8,1
64,256,131072,64,256,32,0,FP8_E4M3,1.01588,4.22781
64,256,131072,64,256,32,2,FP8_E4M3,1.53664,2.79504
64,256,131072,64,256,32,3,FP8_E4M3,1.03031,4.16861
64,256,131072,64,256,32,4,FP8_E4M3,1.0154,4.22983
64,256,131072,64,256,32,5,FP8_E4M3,1.01557,4.22912
64,256,131072,64,256,32,6,FP8_E4M3,1.0156,4.229
64,256,131072,64,256,32,7,FP8_E4M3,1.01554,4.22924
64,256,131072,64,256,32,8,FP8_E4M3,1.01539,4.22986
64,256,131072,64,256,64,0,FP8_E4M3,0.513427,8.36529
64,256,131072,64,256,64,2,FP8_E4M3,0.878051,4.89148
64,256,131072,64,256,64,3,FP8_E4M3,0.591302,7.26357
64,256,131072,64,256,64,4,FP8_E4M3,0.513502,8.36406
64,256,131072,64,256,64,5,FP8_E4M3,0.51369,8.36102
64,256,131072,64,256,64,6,FP8_E4M3,0.513525,8.3637
64,256,131072,64,256,64,7,FP8_E4M3,0.51345,8.36492
64,256,131072,64,256,64,8,FP8_E4M3,0.513568,8.363
64,256,131072,64,256,128,0,FP8_E4M3,0.413098,10.397
64,256,131072,64,256,128,2,FP8_E4M3,0.55208,7.77961
64,256,131072,64,256,128,3,FP8_E4M3,0.413126,10.3963
64,256,131072,64,256,128,4,FP8_E4M3,0.413125,10.3963
64,256,131072,64,256,128,5,FP8_E4M3,0.413112,10.3966
# BUILD_FAILED: 64,256,128,6,1
# BUILD_FAILED: 64,256,128,7,1
# BUILD_FAILED: 64,256,128,8,1
64,256,131072,64,256,256,0,FP8_E4M3,0.450192,9.5403
64,256,131072,64,256,256,2,FP8_E4M3,0.450096,9.54234
# BUILD_FAILED: 64,256,256,3,1
# BUILD_FAILED: 64,256,256,4,1
# BUILD_FAILED: 64,256,256,5,1
# BUILD_FAILED: 64,256,256,6,1
# BUILD_FAILED: 64,256,256,7,1
# BUILD_FAILED: 64,256,256,8,1
# BUILD_FAILED: 64,256,512,0,1
# BUILD_FAILED: 64,256,512,2,1
# BUILD_FAILED: 64,256,512,3,1
# BUILD_FAILED: 64,256,512,4,1
# BUILD_FAILED: 64,256,512,5,1
# BUILD_FAILED: 64,256,512,6,1
# BUILD_FAILED: 64,256,512,7,1
# BUILD_FAILED: 64,256,512,8,1
128,16,131072,128,16,32,0,FP8_E4M3,0.460795,1.1651
128,16,131072,128,16,32,2,FP8_E4M3,1.09942,0.488322
128,16,131072,128,16,32,3,FP8_E4M3,0.73676,0.728692
128,16,131072,128,16,32,4,FP8_E4M3,0.55325,0.970395
128,16,131072,128,16,32,5,FP8_E4M3,0.459144,1.16929
128,16,131072,128,16,32,6,FP8_E4M3,0.459259,1.16899
128,16,131072,128,16,32,7,FP8_E4M3,0.459246,1.16903
128,16,131072,128,16,32,8,FP8_E4M3,0.459158,1.16925
128,16,131072,128,16,64,0,FP8_E4M3,0.23367,2.29756
128,16,131072,128,16,64,2,FP8_E4M3,0.588616,0.91209
128,16,131072,128,16,64,3,FP8_E4M3,0.39581,1.35639
128,16,131072,128,16,64,4,FP8_E4M3,0.298618,1.79785
128,16,131072,128,16,64,5,FP8_E4M3,0.241062,2.2271
128,16,131072,128,16,64,6,FP8_E4M3,0.233896,2.29534
128,16,131072,128,16,64,7,FP8_E4M3,0.233827,2.29602
128,16,131072,128,16,64,8,FP8_E4M3,0.233718,2.29708
128,16,131072,128,16,128,0,FP8_E4M3,0.130026,4.12896
128,16,131072,128,16,128,2,FP8_E4M3,0.337763,1.58949
128,16,131072,128,16,128,3,FP8_E4M3,0.228035,2.35433
128,16,131072,128,16,128,4,FP8_E4M3,0.172787,3.10712
128,16,131072,128,16,128,5,FP8_E4M3,0.14085,3.81166
128,16,131072,128,16,128,6,FP8_E4M3,0.129906,4.13278
128,16,131072,128,16,128,7,FP8_E4M3,0.12999,4.13008
128,16,131072,128,16,128,8,FP8_E4M3,0.129954,4.13125
128,16,131072,128,16,256,0,FP8_E4M3,0.132677,4.04646
128,16,131072,128,16,256,2,FP8_E4M3,0.235147,2.28313
128,16,131072,128,16,256,3,FP8_E4M3,0.159227,3.37173
128,16,131072,128,16,256,4,FP8_E4M3,0.13263,4.04787
128,16,131072,128,16,256,5,FP8_E4M3,0.132762,4.04387
128,16,131072,128,16,256,6,FP8_E4M3,0.132443,4.05359
# BUILD_FAILED: 128,16,256,7,1
# BUILD_FAILED: 128,16,256,8,1
128,16,131072,128,16,512,0,FP8_E4M3,0.137688,3.89918
128,16,131072,128,16,512,2,FP8_E4M3,0.188816,2.84336
128,16,131072,128,16,512,3,FP8_E4M3,0.137685,3.89928
# BUILD_FAILED: 128,16,512,4,1
# BUILD_FAILED: 128,16,512,5,1
# BUILD_FAILED: 128,16,512,6,1
# BUILD_FAILED: 128,16,512,7,1
# BUILD_FAILED: 128,16,512,8,1
128,32,131072,128,32,32,0,FP8_E4M3,0.510517,2.10324
128,32,131072,128,32,32,2,FP8_E4M3,1.13504,0.945996
128,32,131072,128,32,32,3,FP8_E4M3,0.759904,1.413
128,32,131072,128,32,32,4,FP8_E4M3,0.571499,1.87882
128,32,131072,128,32,32,5,FP8_E4M3,0.510498,2.10332
128,32,131072,128,32,32,6,FP8_E4M3,0.510478,2.1034
128,32,131072,128,32,32,7,FP8_E4M3,0.510485,2.10338
128,32,131072,128,32,32,8,FP8_E4M3,0.510525,2.10321
128,32,131072,128,32,64,0,FP8_E4M3,0.258979,4.14605
128,32,131072,128,32,64,2,FP8_E4M3,0.608091,1.76576
128,32,131072,128,32,64,3,FP8_E4M3,0.409082,2.62476
128,32,131072,128,32,64,4,FP8_E4M3,0.307682,3.48978
128,32,131072,128,32,64,5,FP8_E4M3,0.259005,4.14564
128,32,131072,128,32,64,6,FP8_E4M3,0.258904,4.14726
128,32,131072,128,32,64,7,FP8_E4M3,0.258864,4.1479
128,32,131072,128,32,64,8,FP8_E4M3,0.258707,4.15041
128,32,131072,128,32,128,0,FP8_E4M3,0.136731,7.85294
128,32,131072,128,32,128,2,FP8_E4M3,0.3534,3.03832
128,32,131072,128,32,128,3,FP8_E4M3,0.236952,4.53147
128,32,131072,128,32,128,4,FP8_E4M3,0.180846,5.93731
128,32,131072,128,32,128,5,FP8_E4M3,0.146933,7.30771
128,32,131072,128,32,128,6,FP8_E4M3,0.13667,7.85643
128,32,131072,128,32,128,7,FP8_E4M3,0.136549,7.86343
128,32,131072,128,32,128,8,FP8_E4M3,0.136661,7.85698
128,32,131072,128,32,256,0,FP8_E4M3,0.136827,7.84743
128,32,131072,128,32,256,2,FP8_E4M3,0.249325,4.3066
128,32,131072,128,32,256,3,FP8_E4M3,0.16749,6.4108
128,32,131072,128,32,256,4,FP8_E4M3,0.136675,7.85616
128,32,131072,128,32,256,5,FP8_E4M3,0.136816,7.84807
# BUILD_FAILED: 128,32,256,6,1
# BUILD_FAILED: 128,32,256,7,1
# BUILD_FAILED: 128,32,256,8,1
128,32,131072,128,32,512,0,FP8_E4M3,0.198789,5.40142
128,32,131072,128,32,512,2,FP8_E4M3,0.198917,5.39794
# BUILD_FAILED: 128,32,512,3,1
# BUILD_FAILED: 128,32,512,4,1
# BUILD_FAILED: 128,32,512,5,1
# BUILD_FAILED: 128,32,512,6,1
# BUILD_FAILED: 128,32,512,7,1
# BUILD_FAILED: 128,32,512,8,1
128,64,131072,128,64,32,0,FP8_E4M3,0.611928,3.50937
128,64,131072,128,64,32,2,FP8_E4M3,1.22094,1.75888
128,64,131072,128,64,32,3,FP8_E4M3,0.816291,2.63078
128,64,131072,128,64,32,4,FP8_E4M3,0.616906,3.48106
128,64,131072,128,64,32,5,FP8_E4M3,0.611514,3.51175
128,64,131072,128,64,32,6,FP8_E4M3,0.611685,3.51077
128,64,131072,128,64,32,7,FP8_E4M3,0.611646,3.51099
128,64,131072,128,64,32,8,FP8_E4M3,0.611699,3.51069
128,64,131072,128,64,64,0,FP8_E4M3,0.309981,6.9278
128,64,131072,128,64,64,2,FP8_E4M3,0.656032,3.27344
128,64,131072,128,64,64,3,FP8_E4M3,0.440718,4.87269
128,64,131072,128,64,64,4,FP8_E4M3,0.334085,6.42796
128,64,131072,128,64,64,5,FP8_E4M3,0.309675,6.93463
128,64,131072,128,64,64,6,FP8_E4M3,0.309754,6.93288
128,64,131072,128,64,64,7,FP8_E4M3,0.309739,6.9332
128,64,131072,128,64,64,8,FP8_E4M3,0.309661,6.93495
128,64,131072,128,64,128,0,FP8_E4M3,0.163462,13.1375
128,64,131072,128,64,128,2,FP8_E4M3,0.385701,5.56774
128,64,131072,128,64,128,3,FP8_E4M3,0.258653,8.30257
128,64,131072,128,64,128,4,FP8_E4M3,0.197163,10.8919
128,64,131072,128,64,128,5,FP8_E4M3,0.163363,13.1455
128,64,131072,128,64,128,6,FP8_E4M3,0.163382,13.1439
128,64,131072,128,64,128,7,FP8_E4M3,0.163192,13.1592
128,64,131072,128,64,128,8,FP8_E4M3,0.163275,13.1525
128,64,131072,128,64,256,0,FP8_E4M3,0.163365,13.1453
128,64,131072,128,64,256,2,FP8_E4M3,0.278005,7.72463
128,64,131072,128,64,256,3,FP8_E4M3,0.186744,11.4996
128,64,131072,128,64,256,4,FP8_E4M3,0.163349,13.1466
# BUILD_FAILED: 128,64,256,5,1
# BUILD_FAILED: 128,64,256,6,1
# BUILD_FAILED: 128,64,256,7,1
# BUILD_FAILED: 128,64,256,8,1
128,64,131072,128,64,512,0,FP8_E4M3,0.227979,9.41965
128,64,131072,128,64,512,2,FP8_E4M3,0.228238,9.40895
# BUILD_FAILED: 128,64,512,3,1
# BUILD_FAILED: 128,64,512,4,1
# BUILD_FAILED: 128,64,512,5,1
# BUILD_FAILED: 128,64,512,6,1
# BUILD_FAILED: 128,64,512,7,1
# BUILD_FAILED: 128,64,512,8,1
128,128,131072,128,128,32,0,FP8_E4M3,0.814475,5.27329
128,128,131072,128,128,32,2,FP8_E4M3,1.36159,3.15438
128,128,131072,128,128,32,3,FP8_E4M3,0.909947,4.72002
128,128,131072,128,128,32,4,FP8_E4M3,0.814432,5.27357
128,128,131072,128,128,32,5,FP8_E4M3,0.814469,5.27334
128,128,131072,128,128,32,6,FP8_E4M3,0.814378,5.27393
128,128,131072,128,128,32,7,FP8_E4M3,0.814342,5.27415
128,128,131072,128,128,32,8,FP8_E4M3,0.814262,5.27467
128,128,131072,128,128,64,0,FP8_E4M3,0.412366,10.4154
128,128,131072,128,128,64,2,FP8_E4M3,0.742589,5.78378
128,128,131072,128,128,64,3,FP8_E4M3,0.496899,8.64354
128,128,131072,128,128,64,4,FP8_E4M3,0.412098,10.4222
128,128,131072,128,128,64,5,FP8_E4M3,0.41229,10.4174
128,128,131072,128,128,64,6,FP8_E4M3,0.412195,10.4197
128,128,131072,128,128,64,7,FP8_E4M3,0.412216,10.4192
128,128,131072,128,128,64,8,FP8_E4M3,0.412261,10.4181
128,128,131072,128,128,128,0,FP8_E4M3,0.216614,19.8277
128,128,131072,128,128,128,2,FP8_E4M3,0.443734,9.67914
128,128,131072,128,128,128,3,FP8_E4M3,0.297147,14.454
128,128,131072,128,128,128,4,FP8_E4M3,0.226824,18.9352
128,128,131072,128,128,128,5,FP8_E4M3,0.216637,19.8257
128,128,131072,128,128,128,6,FP8_E4M3,0.216562,19.8325
128,128,131072,128,128,128,7,FP8_E4M3,0.216763,19.8141
# BUILD_FAILED: 128,128,128,8,1
128,128,131072,128,128,256,0,FP8_E4M3,0.225981,19.0059
128,128,131072,128,128,256,2,FP8_E4M3,0.33391,12.8626
128,128,131072,128,128,256,3,FP8_E4M3,0.22573,19.027
# BUILD_FAILED: 128,128,256,4,1
# BUILD_FAILED: 128,128,256,5,1
# BUILD_FAILED: 128,128,256,6,1
# BUILD_FAILED: 128,128,256,7,1
# BUILD_FAILED: 128,128,256,8,1
# BUILD_FAILED: 128,128,512,0,1
# BUILD_FAILED: 128,128,512,2,1
# BUILD_FAILED: 128,128,512,3,1
# BUILD_FAILED: 128,128,512,4,1
# BUILD_FAILED: 128,128,512,5,1
# BUILD_FAILED: 128,128,512,6,1
# BUILD_FAILED: 128,128,512,7,1
# BUILD_FAILED: 128,128,512,8,1
128,192,131072,128,192,32,0,FP8_E4M3,1.01676,6.33624
128,192,131072,128,192,32,2,FP8_E4M3,1.5252,4.22399
128,192,131072,128,192,32,3,FP8_E4M3,1.02045,6.31335
128,192,131072,128,192,32,4,FP8_E4M3,1.01661,6.3372
128,192,131072,128,192,32,5,FP8_E4M3,1.0168,6.33602
128,192,131072,128,192,32,6,FP8_E4M3,1.01661,6.33716
128,192,131072,128,192,32,7,FP8_E4M3,1.01665,6.33692
128,192,131072,128,192,32,8,FP8_E4M3,1.0166,6.33725
128,192,131072,128,192,64,0,FP8_E4M3,0.514438,12.5233
128,192,131072,128,192,64,2,FP8_E4M3,0.848552,7.59229
128,192,131072,128,192,64,3,FP8_E4M3,0.568878,11.3248
128,192,131072,128,192,64,4,FP8_E4M3,0.514522,12.5212
128,192,131072,128,192,64,5,FP8_E4M3,0.514517,12.5214
128,192,131072,128,192,64,6,FP8_E4M3,0.514613,12.519
128,192,131072,128,192,64,7,FP8_E4M3,0.514531,12.521
128,192,131072,128,192,64,8,FP8_E4M3,0.51456,12.5203
128,192,131072,128,192,128,0,FP8_E4M3,0.313696,20.5372
128,192,131072,128,192,128,2,FP8_E4M3,0.511093,12.6052
128,192,131072,128,192,128,3,FP8_E4M3,0.345923,18.6239
128,192,131072,128,192,128,4,FP8_E4M3,0.313693,20.5375
128,192,131072,128,192,128,5,FP8_E4M3,0.313826,20.5288
# BUILD_FAILED: 128,192,128,6,1
# BUILD_FAILED: 128,192,128,7,1
# BUILD_FAILED: 128,192,128,8,1
128,192,131072,128,192,256,0,FP8_E4M3,0.401674,16.039
128,192,131072,128,192,256,2,FP8_E4M3,0.401384,16.0506
# BUILD_FAILED: 128,192,256,3,1
# BUILD_FAILED: 128,192,256,4,1
# BUILD_FAILED: 128,192,256,5,1
# BUILD_FAILED: 128,192,256,6,1
# BUILD_FAILED: 128,192,256,7,1
# BUILD_FAILED: 128,192,256,8,1
# BUILD_FAILED: 128,192,512,0,1
# BUILD_FAILED: 128,192,512,2,1
# BUILD_FAILED: 128,192,512,3,1
# BUILD_FAILED: 128,192,512,4,1
# BUILD_FAILED: 128,192,512,5,1
# BUILD_FAILED: 128,192,512,6,1
# BUILD_FAILED: 128,192,512,7,1
# BUILD_FAILED: 128,192,512,8,1
128,256,131072,128,256,32,0,FP8_E4M3,1.21921,7.04548
128,256,131072,128,256,32,2,FP8_E4M3,1.6786,5.11731
128,256,131072,128,256,32,3,FP8_E4M3,1.21914,7.0459
128,256,131072,128,256,32,4,FP8_E4M3,1.21904,7.04647
128,256,131072,128,256,32,5,FP8_E4M3,1.21916,7.04577
128,256,131072,128,256,32,6,FP8_E4M3,1.21915,7.04586
128,256,131072,128,256,32,7,FP8_E4M3,1.21909,7.04621
128,256,131072,128,256,32,8,FP8_E4M3,1.21909,7.04621
128,256,131072,128,256,64,0,FP8_E4M3,0.616926,13.9238
128,256,131072,128,256,64,2,FP8_E4M3,0.952798,9.01548
128,256,131072,128,256,64,3,FP8_E4M3,0.642122,13.3774
128,256,131072,128,256,64,4,FP8_E4M3,0.616782,13.927
128,256,131072,128,256,64,5,FP8_E4M3,0.616933,13.9236
128,256,131072,128,256,64,6,FP8_E4M3,0.61677,13.9273
128,256,131072,128,256,64,7,FP8_E4M3,0.616878,13.9248
128,256,131072,128,256,64,8,FP8_E4M3,0.616843,13.9256
128,256,131072,128,256,128,0,FP8_E4M3,0.416226,20.6377
128,256,131072,128,256,128,2,FP8_E4M3,0.588677,14.5919
128,256,131072,128,256,128,3,FP8_E4M3,0.416278,20.6351
128,256,131072,128,256,128,4,FP8_E4M3,0.416341,20.632
# BUILD_FAILED: 128,256,128,5,1
# BUILD_FAILED: 128,256,128,6,1
# BUILD_FAILED: 128,256,128,7,1
# BUILD_FAILED: 128,256,128,8,1
128,256,131072,128,256,256,0,FP8_E4M3,0.481704,17.8324
128,256,131072,128,256,256,2,FP8_E4M3,0.481899,17.8252
# BUILD_FAILED: 128,256,256,3,1
# BUILD_FAILED: 128,256,256,4,1
# BUILD_FAILED: 128,256,256,5,1
# BUILD_FAILED: 128,256,256,6,1
# BUILD_FAILED: 128,256,256,7,1
# BUILD_FAILED: 128,256,256,8,1
# BUILD_FAILED: 128,256,512,0,1
# BUILD_FAILED: 128,256,512,2,1
# BUILD_FAILED: 128,256,512,3,1
# BUILD_FAILED: 128,256,512,4,1
# BUILD_FAILED: 128,256,512,5,1
# BUILD_FAILED: 128,256,512,6,1
# BUILD_FAILED: 128,256,512,7,1
# BUILD_FAILED: 128,256,512,8,1
